{
  "report_id": "rs-eval-001",
  "extraction_report_id": "rs-extract-001",
  "created_at": "2026-03-20T10:10:00Z",
  "credibility_score": "medium",
  "credibility_evidence": [
    "Content aligns with official Python docs on venv",
    "Author demonstrates commands; not purely theoretical"
  ],
  "hype_level": "low",
  "hype_evidence": [],
  "usefulness": "high",
  "archive_recommendation": "archive_with_warnings",
  "warnings": [
    "Video may be dated; verify pyproject.toml adoption for current projects",
    "Windows activation path shown; Unix/Mac may differ"
  ]
}
